{
  "journey_id": "journey_demo_001",
  "version": "0.7.0",
  "audience_fit_id": "audfit_demo_001",
  "positioning_fit_id": "fit_demo_001",
  "journeys": [
    {
      "journey_path_id": "jp_demo_001",
      "audience_id": "aud_demo_buyer",
      "offer_id": "offer_demo_automation",
      "role": "DECISION_MAKER",
      "state": "PROBLEM_AWARE",
      "state_confidence": "SUPPORTED",
      "problem_or_job": "reduce repetitive operational work",
      "current_question": "Is this problem large enough to justify changing the current workflow?",
      "next_decision": "whether to evaluate solution approaches",
      "questions": ["What is actually causing the manual workload?"],
      "objections": ["automation may create more complexity"],
      "perceived_risks": ["disruption to existing operations"],
      "trust_requirements": ["clear diagnosis before recommending tools"],
      "proof_needed": ["examples of comparable workflow redesign"],
      "alternatives": ["keep the current manual process"],
      "switching_friction": ["team habit and implementation effort"],
      "triggers": ["manual workload becomes a visible bottleneck"],
      "content_jobs": ["DIAGNOSE", "EDUCATE", "DE_RISK"],
      "desired_action": "evaluate whether the workflow is a fit for automation",
      "cta_strength": "LOW",
      "supporting_claim_ids": ["claim_demo_001"],
      "supporting_voc_ids": [],
      "limitations": ["purchase readiness has not been observed"]
    },
    {
      "journey_path_id": "jp_demo_002",
      "audience_id": "aud_demo_buyer",
      "offer_id": "offer_demo_automation",
      "role": "DECISION_MAKER",
      "state": "TRUST_VALIDATING",
      "state_confidence": "HYPOTHESIS",
      "problem_or_job": "select a credible implementation partner",
      "current_question": "Can this provider understand the workflow and deliver a reliable result?",
      "next_decision": "whether to start a commercial conversation",
      "questions": [],
      "objections": [],
      "perceived_risks": [],
      "trust_requirements": ["proof and process transparency"],
      "proof_needed": ["relevant case or working demonstration"],
      "alternatives": [],
      "switching_friction": [],
      "triggers": [],
      "content_jobs": ["PROVE", "DE_RISK", "QUALIFY"],
      "desired_action": "request details if fit is established",
      "cta_strength": "MEDIUM",
      "supporting_claim_ids": [],
      "supporting_voc_ids": [],
      "limitations": ["this state is an explicit hypothesis and must not be presented as observed buyer behavior"]
    }
  ],
  "primary_journeys": ["jp_demo_001"],
  "unknown_journey_states": ["purchase-ready behavior for aud_demo_buyer"],
  "journey_gaps": ["no verified conversion-path evidence"],
  "research_requests": ["collect VOC or first-party sales conversations about evaluation and trust objections"],
  "questions_required_from_user": [],
  "safe_for_strategy": true
}
